{
  "ledgerVersion":"0.15","sequence":0,"timestamp":"2026-08-17T03:00:00Z","pluginId":"com.example.echo","activationInstance":"act-1","runtimeGenerationId":"gen-1","operation":"create","resource":{"kind":"command","id":"com.example.echo.ping"},"result":"applied","valueDigest":"sha256:bbbbbbbbbbbbbbbbbbbbbbbbbbbbbbbbbbbbbbbbbbbbbbbbbbbbbbbbbbbbbbbb"
}
